{
  "$schema": "https://json-schema.org/draft/2020-12/schema",
  "$id": "https://proxy.desplega.sh/contracts/telemetry/ranking/listing.v1.schema.json",
  "title": "TelemetryRankingV1",
  "description": "The telemetry_ranking listing, version 1. agent-swarm stores it stringified in the global swarm_config key telemetry_ranking and sends the same string as the listing property of ranking.opted_in. The string must not exceed 2048 bytes. The ingest also requires name to equal context.org_name and domain to equal context.org_website. Text fields are trimmed before their length is checked; lengths count UTF-16 code units, as JavaScript does.",
  "type": "object",
  "additionalProperties": false,
  "required": ["v", "claim", "name", "domain", "category", "subcategory", "description", "sourceCodeUrl", "updatedAt"],
  "properties": {
    "v": {
      "const": 1,
      "description": "Listing version. A new version is a new schema file, never an edit to this one."
    },
    "claim": {
      "type": "string",
      "pattern": "^rk_[0-9a-f]{32}$",
      "description": "Claim minted by the install. The ranking PR carries it, and the proxy binds it to the first install that sent it. Never served publicly."
    },
    "name": {
      "type": "string",
      "minLength": 1,
      "maxLength": 60,
      "description": "Copied from SWARM_ORG_NAME. Served as app.title."
    },
    "domain": {
      "type": "string",
      "maxLength": 253,
      "pattern": "^[a-z0-9]([a-z0-9-]*[a-z0-9])?(\\.[a-z0-9]([a-z0-9-]*[a-z0-9])?)+$",
      "description": "Copied from SWARM_ORG_WEBSITE: a lowercase hostname without scheme, path or port. Served as app.slug."
    },
    "category": {
      "type": "string",
      "enum": ["engineering", "product", "marketing", "support", "operations", "other"],
      "description": "A key of taxonomy.json. Served as the group filter."
    },
    "subcategory": {
      "type": ["string", "null"],
      "maxLength": 40,
      "pattern": "^[a-z0-9]+(-[a-z0-9]+)*$",
      "description": "One of taxonomy.json's subcategories for category, or null. Served as app.categories."
    },
    "description": {
      "type": ["string", "null"],
      "minLength": 1,
      "maxLength": 160,
      "description": "Optional one-line description. Served as app.description."
    },
    "sourceCodeUrl": {
      "type": ["string", "null"],
      "maxLength": 200,
      "pattern": "^https://",
      "description": "Optional https URL. Served as app.source_code_url."
    },
    "updatedAt": {
      "type": "string",
      "format": "date-time",
      "pattern": "^[0-9]{4}-[0-9]{2}-[0-9]{2}T[0-9]{2}:[0-9]{2}:[0-9]{2}(\\.[0-9]+)?Z$",
      "description": "When the install built this listing, in UTC with a Z suffix."
    }
  }
}
