{
  "v": 1,
  "claim": "rk_3f9a1c0e7b2d4a6f8e1c3b5d7f9a2c4e",
  "name": "Imtec",
  "domain": "imtec.ba",
  "category": "marketing",
  "subcategory": null,
  "description": "QA and release automation for our web apps",
  "sourceCodeUrl": "https://github.com/imtec/agents",
  "updatedAt": "2026-10-18T10:00:00.000Z"
}
